[
  {
    "id": "toyota/camry",
    "makeId": "toyota",
    "name": "Camry",
    "aliases": []
  },
  {
    "id": "toyota/corolla",
    "makeId": "toyota",
    "name": "Corolla",
    "aliases": []
  },
  {
    "id": "toyota/corolla-cross",
    "makeId": "toyota",
    "name": "Corolla Cross",
    "aliases": []
  },
  {
    "id": "toyota/yaris",
    "makeId": "toyota",
    "name": "Yaris",
    "aliases": []
  },
  {
    "id": "toyota/land-cruiser",
    "makeId": "toyota",
    "name": "Land Cruiser",
    "aliases": []
  },
  {
    "id": "toyota/prado",
    "makeId": "toyota",
    "name": "Prado",
    "aliases": [
      "Land Cruiser Prado"
    ]
  },
  {
    "id": "toyota/hilux",
    "makeId": "toyota",
    "name": "Hilux",
    "aliases": []
  },
  {
    "id": "toyota/fortuner",
    "makeId": "toyota",
    "name": "Fortuner",
    "aliases": []
  },
  {
    "id": "toyota/rav4",
    "makeId": "toyota",
    "name": "RAV4",
    "aliases": [
      "RAV 4"
    ]
  },
  {
    "id": "toyota/avalon",
    "makeId": "toyota",
    "name": "Avalon",
    "aliases": []
  },
  {
    "id": "toyota/rush",
    "makeId": "toyota",
    "name": "Rush",
    "aliases": []
  },
  {
    "id": "toyota/hiace",
    "makeId": "toyota",
    "name": "Hiace",
    "aliases": [
      "HiAce"
    ]
  },
  {
    "id": "toyota/innova",
    "makeId": "toyota",
    "name": "Innova",
    "aliases": []
  },
  {
    "id": "toyota/highlander",
    "makeId": "toyota",
    "name": "Highlander",
    "aliases": []
  },
  {
    "id": "toyota/sequoia",
    "makeId": "toyota",
    "name": "Sequoia",
    "aliases": []
  },
  {
    "id": "toyota/raize",
    "makeId": "toyota",
    "name": "Raize",
    "aliases": []
  },
  {
    "id": "toyota/crown",
    "makeId": "toyota",
    "name": "Crown",
    "aliases": []
  },
  {
    "id": "toyota/supra",
    "makeId": "toyota",
    "name": "Supra",
    "aliases": []
  },
  {
    "id": "toyota/sienna",
    "makeId": "toyota",
    "name": "Sienna",
    "aliases": []
  },
  {
    "id": "nissan/altima",
    "makeId": "nissan",
    "name": "Altima",
    "aliases": []
  },
  {
    "id": "nissan/sunny",
    "makeId": "nissan",
    "name": "Sunny",
    "aliases": []
  },
  {
    "id": "nissan/sentra",
    "makeId": "nissan",
    "name": "Sentra",
    "aliases": []
  },
  {
    "id": "nissan/maxima",
    "makeId": "nissan",
    "name": "Maxima",
    "aliases": []
  },
  {
    "id": "nissan/patrol",
    "makeId": "nissan",
    "name": "Patrol",
    "aliases": []
  },
  {
    "id": "nissan/x-trail",
    "makeId": "nissan",
    "name": "X-Trail",
    "aliases": [
      "X Trail",
      "XTrail"
    ]
  },
  {
    "id": "nissan/kicks",
    "makeId": "nissan",
    "name": "Kicks",
    "aliases": []
  },
  {
    "id": "nissan/navara",
    "makeId": "nissan",
    "name": "Navara",
    "aliases": []
  },
  {
    "id": "nissan/pathfinder",
    "makeId": "nissan",
    "name": "Pathfinder",
    "aliases": []
  },
  {
    "id": "nissan/qashqai",
    "makeId": "nissan",
    "name": "Qashqai",
    "aliases": []
  },
  {
    "id": "nissan/juke",
    "makeId": "nissan",
    "name": "Juke",
    "aliases": []
  },
  {
    "id": "nissan/murano",
    "makeId": "nissan",
    "name": "Murano",
    "aliases": []
  },
  {
    "id": "nissan/armada",
    "makeId": "nissan",
    "name": "Armada",
    "aliases": []
  },
  {
    "id": "nissan/micra",
    "makeId": "nissan",
    "name": "Micra",
    "aliases": []
  },
  {
    "id": "nissan/gt-r",
    "makeId": "nissan",
    "name": "GT-R",
    "aliases": [
      "GTR"
    ]
  },
  {
    "id": "honda/accord",
    "makeId": "honda",
    "name": "Accord",
    "aliases": []
  },
  {
    "id": "honda/civic",
    "makeId": "honda",
    "name": "Civic",
    "aliases": []
  },
  {
    "id": "honda/cr-v",
    "makeId": "honda",
    "name": "CR-V",
    "aliases": [
      "CRV"
    ]
  },
  {
    "id": "honda/hr-v",
    "makeId": "honda",
    "name": "HR-V",
    "aliases": [
      "HRV"
    ]
  },
  {
    "id": "honda/city",
    "makeId": "honda",
    "name": "City",
    "aliases": []
  },
  {
    "id": "honda/pilot",
    "makeId": "honda",
    "name": "Pilot",
    "aliases": []
  },
  {
    "id": "honda/odyssey",
    "makeId": "honda",
    "name": "Odyssey",
    "aliases": []
  },
  {
    "id": "honda/jazz",
    "makeId": "honda",
    "name": "Jazz",
    "aliases": [
      "Fit"
    ]
  },
  {
    "id": "honda/passport",
    "makeId": "honda",
    "name": "Passport",
    "aliases": []
  },
  {
    "id": "honda/br-v",
    "makeId": "honda",
    "name": "BR-V",
    "aliases": [
      "BRV"
    ]
  },
  {
    "id": "hyundai/elantra",
    "makeId": "hyundai",
    "name": "Elantra",
    "aliases": []
  },
  {
    "id": "hyundai/sonata",
    "makeId": "hyundai",
    "name": "Sonata",
    "aliases": []
  },
  {
    "id": "hyundai/tucson",
    "makeId": "hyundai",
    "name": "Tucson",
    "aliases": []
  },
  {
    "id": "hyundai/santa-fe",
    "makeId": "hyundai",
    "name": "Santa Fe",
    "aliases": [
      "Santafe"
    ]
  },
  {
    "id": "hyundai/accent",
    "makeId": "hyundai",
    "name": "Accent",
    "aliases": []
  },
  {
    "id": "hyundai/creta",
    "makeId": "hyundai",
    "name": "Creta",
    "aliases": []
  },
  {
    "id": "hyundai/kona",
    "makeId": "hyundai",
    "name": "Kona",
    "aliases": []
  },
  {
    "id": "hyundai/palisade",
    "makeId": "hyundai",
    "name": "Palisade",
    "aliases": []
  },
  {
    "id": "hyundai/azera",
    "makeId": "hyundai",
    "name": "Azera",
    "aliases": [
      "Grandeur"
    ]
  },
  {
    "id": "hyundai/venue",
    "makeId": "hyundai",
    "name": "Venue",
    "aliases": []
  },
  {
    "id": "hyundai/i10",
    "makeId": "hyundai",
    "name": "i10",
    "aliases": []
  },
  {
    "id": "hyundai/i20",
    "makeId": "hyundai",
    "name": "i20",
    "aliases": []
  },
  {
    "id": "hyundai/i30",
    "makeId": "hyundai",
    "name": "i30",
    "aliases": []
  },
  {
    "id": "hyundai/staria",
    "makeId": "hyundai",
    "name": "Staria",
    "aliases": []
  },
  {
    "id": "hyundai/ioniq-5",
    "makeId": "hyundai",
    "name": "Ioniq 5",
    "aliases": [
      "Ioniq5"
    ]
  },
  {
    "id": "kia/sportage",
    "makeId": "kia",
    "name": "Sportage",
    "aliases": []
  },
  {
    "id": "kia/sorento",
    "makeId": "kia",
    "name": "Sorento",
    "aliases": []
  },
  {
    "id": "kia/cerato",
    "makeId": "kia",
    "name": "Cerato",
    "aliases": [
      "Forte",
      "K3"
    ]
  },
  {
    "id": "kia/optima",
    "makeId": "kia",
    "name": "Optima",
    "aliases": [
      "K5"
    ]
  },
  {
    "id": "kia/picanto",
    "makeId": "kia",
    "name": "Picanto",
    "aliases": []
  },
  {
    "id": "kia/rio",
    "makeId": "kia",
    "name": "Rio",
    "aliases": []
  },
  {
    "id": "kia/seltos",
    "makeId": "kia",
    "name": "Seltos",
    "aliases": []
  },
  {
    "id": "kia/telluride",
    "makeId": "kia",
    "name": "Telluride",
    "aliases": []
  },
  {
    "id": "kia/carnival",
    "makeId": "kia",
    "name": "Carnival",
    "aliases": [
      "Sedona"
    ]
  },
  {
    "id": "kia/soul",
    "makeId": "kia",
    "name": "Soul",
    "aliases": []
  },
  {
    "id": "kia/stinger",
    "makeId": "kia",
    "name": "Stinger",
    "aliases": []
  },
  {
    "id": "kia/sonet",
    "makeId": "kia",
    "name": "Sonet",
    "aliases": []
  },
  {
    "id": "kia/niro",
    "makeId": "kia",
    "name": "Niro",
    "aliases": []
  },
  {
    "id": "kia/ev6",
    "makeId": "kia",
    "name": "EV6",
    "aliases": []
  },
  {
    "id": "kia/k8",
    "makeId": "kia",
    "name": "K8",
    "aliases": []
  },
  {
    "id": "mazda/mazda2",
    "makeId": "mazda",
    "name": "Mazda2",
    "aliases": [
      "Mazda 2"
    ]
  },
  {
    "id": "mazda/mazda3",
    "makeId": "mazda",
    "name": "Mazda3",
    "aliases": [
      "Mazda 3"
    ]
  },
  {
    "id": "mazda/mazda6",
    "makeId": "mazda",
    "name": "Mazda6",
    "aliases": [
      "Mazda 6"
    ]
  },
  {
    "id": "mazda/cx-3",
    "makeId": "mazda",
    "name": "CX-3",
    "aliases": [
      "CX3"
    ]
  },
  {
    "id": "mazda/cx-30",
    "makeId": "mazda",
    "name": "CX-30",
    "aliases": [
      "CX30"
    ]
  },
  {
    "id": "mazda/cx-5",
    "makeId": "mazda",
    "name": "CX-5",
    "aliases": [
      "CX5"
    ]
  },
  {
    "id": "mazda/cx-9",
    "makeId": "mazda",
    "name": "CX-9",
    "aliases": [
      "CX9"
    ]
  },
  {
    "id": "mazda/mx-5",
    "makeId": "mazda",
    "name": "MX-5",
    "aliases": [
      "MX5",
      "Miata"
    ]
  },
  {
    "id": "mazda/bt-50",
    "makeId": "mazda",
    "name": "BT-50",
    "aliases": [
      "BT50"
    ]
  },
  {
    "id": "mitsubishi/lancer",
    "makeId": "mitsubishi",
    "name": "Lancer",
    "aliases": []
  },
  {
    "id": "mitsubishi/pajero",
    "makeId": "mitsubishi",
    "name": "Pajero",
    "aliases": [
      "Montero"
    ]
  },
  {
    "id": "mitsubishi/outlander",
    "makeId": "mitsubishi",
    "name": "Outlander",
    "aliases": []
  },
  {
    "id": "mitsubishi/asx",
    "makeId": "mitsubishi",
    "name": "ASX",
    "aliases": []
  },
  {
    "id": "mitsubishi/l200",
    "makeId": "mitsubishi",
    "name": "L200",
    "aliases": [
      "Triton"
    ]
  },
  {
    "id": "mitsubishi/attrage",
    "makeId": "mitsubishi",
    "name": "Attrage",
    "aliases": [
      "Mirage G4"
    ]
  },
  {
    "id": "mitsubishi/eclipse-cross",
    "makeId": "mitsubishi",
    "name": "Eclipse Cross",
    "aliases": []
  },
  {
    "id": "mitsubishi/xpander",
    "makeId": "mitsubishi",
    "name": "Xpander",
    "aliases": []
  },
  {
    "id": "mitsubishi/mirage",
    "makeId": "mitsubishi",
    "name": "Mirage",
    "aliases": []
  },
  {
    "id": "suzuki/swift",
    "makeId": "suzuki",
    "name": "Swift",
    "aliases": []
  },
  {
    "id": "suzuki/vitara",
    "makeId": "suzuki",
    "name": "Vitara",
    "aliases": []
  },
  {
    "id": "suzuki/jimny",
    "makeId": "suzuki",
    "name": "Jimny",